sentence,score
마블은 끝났다~이젠 주제가 식상하고 도를 넘어섰다. 어설픈 CG와 내용은 아바타2를 기점으로 끝난거다. 관객을 더이상 조롱하지말고 마블의 새로운 혁명을 기대했건만 관객은 바보가 아니다. 감성팔이는 지친다. DC에 밀린다에 한표~,2
갑자기 죽는 건 의아했지만 감동적입니다,10
"우리나라의 첫 뮤지컬 영화라던데, 그 시도만으로 정말 휼륭했고 그 이상으로 좋았던 영화인 것 같다",10
바다랑 해양 생물 CG 이쁘다말고는 뭐 없음....,5
진짜 재밌네. 태섭이 존잘 ㅋㅋ,10
두가지 삶 모두 가진 병허니형 그는 대체..,8
새해에는 행복하자는 다짐,9
잼있네요. 지금 보네요. 이문식씨 이제 나이들었겠네요,10
너무 감동적이였습니다,10
진부한 스토리라인과 아름다운 영상미.,5
중간에 계속 송태섭 얘기 나와서 흐름끊어짐 ,1
최고다 진짜 영화로 볼 수 있어서 너무나 행복했다,10
전무후무한 SF명작.또 봐도 다시 봐도 재밌다.,10
두번보세요 아니 세번 보세요,10
"꼭 봐야할 영화, 잊지 말아할 우리 역사",10
최고의 캐스팅은 나문희 선생님인듯^^진짜 안중근 의사의 어머니도 그렇게하셨을것같애요한복 지으면서 우시는 모습에 눈물이 흘렀습니다ㅜㅜ 통곡하지 않는 모습이 더 슬펏어요ㅠ영화보면서 안중근 의사가 얼마나 두렵고 무서웟을까를 생각하니 또 눈물이 났어요ㅠㅠ ,10
개봉 감사합니다!! 기다렸습니다,10
슬램덩크 보고 그림을 그리기 시작했고 디자이너로 일하고 있습니다. 벅차올라서 리뷰 처음 써보네요.. 다케히코 센세의 필력도 완전히 느낄 수 있는 작품입니다. 이 시대에 살고 있음에 감사합니다.,10
"이미 알고 있는 이야기와 이제 새로 알게된 이야기가 잘 어우러져 추억은 추억대로 떠올랐고, 앞으로 각 캐릭터별의 비하인드 스토리가 기대되는 작품이었습니다. 스포츠 만화라 선악구도가 아니기 때문에 어떤 팀의 어떤 캐릭터라도 괜찮을 것 같습니다. ",9
한번뿐인 인생 후회없는 사랑을 하자,10
회상을 몰던가 줄이던가 뜨거워 질만 하면 회상으로 찬물 뿌리고 슬램덩크가 지루한건 처음임 잔잔한 강물같이 스토리가 흘러감 불같은 열정대신 잔잔함과 고요함으로 대신 채웠음 ,2
연출이 대박임장면장면의 호흡과 카메라무빙 음악까지.감독이 똑똑한 영화가 이거구나다보고나면 궁궐 내부그 안에서도 내의원과 왕과 세자 몇몇인물들의 방정도가 영화 공간의 전부였음..진심연출이 대박인 영화임전 아바타보다 재밌었어요,10
20년만에 태섭쿤의 가정사를 듣고 울어버렸읍니다,10
올해 최고의 영화 손에 땀을 쥐면서 봤음.,10
믿고보는 남돌비,10
애니메이션판 [판의미로],8
투캅스를 진지하게 깔면 이런 느낌이었을까..,5
너무 재미있었고 온몸에 전율이 흘렀다.애기들이 명장면때 웃은것 때문에 집중이 잘 안됐다.,10
불쾌한 골짜기로 떠나는 100분간의 여행.,8
이젠 아핏차퐁한테도 뭘 기대하기가 어려워졌구나... 볼만은 함,5
솔직히 스토리는 너무 뻔한전개였음근데 영상미가 모든걸 커버함. 3시간 내내 눈이 즐거웠음.,10
초중반 몰입도는 참 좋았는데 후반에 클리셰들 때문에 좀 깼다.,6
영화적 예술의 경지 그 자체. 재밌고 웃기고 감동적이고 슬프고 나의 인생을 다시 한 번 되돌아보게 하는 영화. 나의 인생이 정말 보잘 것 없이 허무하게 느껴지다가도 옆에 있는 모든 것들이 있는 나의 순간을 소중히 여기게 되는 영화. 한 영화를 보면서 나의 인생에 대한 다양한 통찰을 하게 된다면 이만큼 더 행복할 수가 없다.,10
도박보다 여인이 독하구나,8
결말을 알고있어도 손에 땀을 쥐게하는 영화..,10
강백호와 서태웅의 하이파이브를 위한 영화,10
어렸을때부터 거의 맨날 이 영화를 보고 지내서 이젠 친구같은 영화...ㅠㅠ ost도 역시 좋고 특히 라푼젤 생일이라고 등불 올려주는거 너무 감동이였다.. 그냥 모든게 완벽한 영화 재개봉했으면 좋겠다.!.!.!,10
국민학교 슬램덩크 나의조던지금인생에서 다시리마인드 이노우에 형님 감사합니다,10
자연스럽게  선생김봉두 잘 표현을 했어요  감동입니다,10
정말 내가 본 영화중 최고의 엔딩장면이었다.,10
역시 맷 데이먼임..추천드림,9
"내가 네게, 네가 내게. 우리가 얼마나 닮아있는지를.상처로 전하는 위로, 회복으로 전하는 응원.",10
기대없이 들어가 재밌게 보고 나왔네요^^,10
무조건 아이맥스 쓰리디로 보십쇼 아니면 후회합니다.,10
그냥 졸X 재밌습니다. 다른 말 필요 없습니다.,10
"존경하는 안중근의사에 영화라 무조건 예매하고 오늘  CGV에서 관람했다. 수도권 오후 1시30분 관람인대 생각보다 빈 좌석이 너무 많아 의아했다. 내 갠적으로 평가한다면 졸작인 군함도랑 동급이라 본다. 영화에 반이상은 뮤지컬이고 내용 또한 안중근의사에 일대기가 절대 아니다.내가 너무 큰 기대를 하고 관람했다는게 내 불찰이다. 뮤지컬 좋아하는 사람들은 좋아할지 모르겠지만 나처럼 역사적 시각으로 기대를 하고 관람은 하지마시길. 뭐랄까??~~안중근의사에 대표적인 사진을 메인 포스터에 홍보용으로 걸어 논거 같은 느낌이 들었다. 또한 스토리도 초등학생 위인전보다 못한 내용이고 긴장감,감동,반전도 없는 지루한 2시간 이였다. 어디까지나 안중근의사에 영화라 큰 기대를 했던 나로써는 영화를 보고 왜 안중근이라는 이름을 안걸고 영웅이라 제목을 했는지 ,관람객이 왜 관람석에 1/10도 안됐는지 스스로 이해되기 시작했다. 관람후 차안에서 와이프가 잼있게 봤어? 물어보길래 &amp;#34;미안하다 내가 죄인이다&amp;#34; 하고 같이 웃으면서 집에 왔다. ",1
잊고 있던 그시절 그감동을 깨우쳐 줬다,10
다 된 밥에 중국 뿌리기 어휴 진짜,1
보고나서 음악 들으며 더욱 감동이 밀려오는 여운을 주는 영화. 그 분들을 잊지 않게 해주는 영화.,10
중국 영화인줄 의상 객잔 어이 없다 ,2
긴 말이 필요없다.... 처음부터 끝까지 벅차오름과 전율로 가득한 영화였다. 꼭 영화관에서 보시길 바랍니다!,10
박우리 너무 귀엽자나~~~,10
최고 진짜 돈이 아깝지않다,10
외화보며 눈물흘린 3편의 영화중 하나가될듯 묘한 영적 감동을 주는 대작보는 내내 영상이 너무 아름다워황홀 했음 강추,10
나도 다시한번 선택의 기회가왔으면...궁금하다 어떤 인생일지 어떠한 기분일지어떠한 선택을할지...,10
스토리도 별로 액션도 별로 영상미도 그렇게까지 좋은줄 모르겠다 처라리 아쿠아맨이 수상전이 훨씬 잼있다 ,4
무거움과 가벼움의 노선찾기 실패,5
이런 영화 좋아요. 끝맺음 확실해서 좋네요.,10
뒤늦게 넷플릭스에서 봤다. 평작 이상의 울림이 있다. 유명감독이나 대기업 제작사의 수백억 호화 캐스팅의 수준 이하 짜깁기 영화보다 몇 배 더 울림이 큰 영화다. 코로나 시기에 홍보도 제대로 못하고 개봉해서 흥행실적이 처참한 것이 못내 아쉽다. ,8
최고다. 슬랭덩크는 만화가아닌 작품이다.,10
담백한데 여운이 남고 계속 생각 나는 맛. 많은 것들이 생략되고 남은 것들의 합이 만들어 내는 힘.,10
소름끼쳤음 장면장면이 감동 와우 역시  ,10
누가 죄인인가 ...이 영화 평점 보고 추천한 내가 오늘 내가 죄인 됏음여친한테 멱살 잡힘 ㅡㅡ,2
어휴...머라해야하나,1
권선징악의 아시아 정서와 안맞아서 짜증남,8
"출연배우, 시대적배경과 영상미에 빠져 선택한영화. 결과는 실망이 큽니다. 소재는 좋은데 연출이 너무 부족한듯, 아쉽네요. 스릴러적 요소 많이 부족합니다. 보는내내 지루해서 죽을뻔! 마지막 20분만 아니면 크리스찬베일에게 크게 실망할뻔했음. 평점이 너무 좋은데 진정 다보신분들인지 의구심듬!",4
산왕전을 이런 고퀄로 볼줄이야,10
울고 웃은 인생 최고의 영화,10
근래들어 드물게 끝까지 본 영화. 이렇게 자극없는 영화 좋아요. 보고나면 기분이 산뜻해져요.,10
아바타2 용아맥으로로 꼭 보세요,10
오랜만에 제대로된 영화봄,10
멋있는 모습도 좋은데 귀엽고 깜찍한 모습도 더 나왔으면,8
단순한 추억팔이가 아니다무조건 봐라대부분 남자혼자보더라,10
별하나도 아깝다 역사왜곡 국뽕은 정신병 ,1
"실제 농구 경기를 보는 듯한 짜릿한 긴장감과 추억의 등장 인물들을 다시 만나게 된 반가움, 경기 끝의 감동까지! 시간 가는 줄 모르고 관람했습니다. 자막으로 봤는데 더빙으로 또 보고싶어요!",10
"가끔 보이는 지구인들이 CG같고, 지구 어딘가에 분명 나비족이 있다는 의심이 생김. ",10
내 책장에 꽂혀있는 슬램덩크를 아들이 보게 되면서 아들은 나보다 더 슬램덩크를 사랑하게 되었다. 아들과 함께 영화를 보게 되고 함께 이야기를 나누는 잊지 못할 추억을 갖게 되었다. 아마도 슬램덩크는 내 아들의 아들도 사랑하게 될 만화가 될 것이다. ,10
치즈버거 PPL 영화임,10
너무 혹평만 봐서 그런지 저는 개인적으로 다 좋았습니다. 가족이 없던 사람들이 가족이 되어가는 모습으로 변화하는 게 참 보기 좋았습니다.,8
인도네시아 영화?오 생각보다 나쁘지 않았음 ㅋ적절한 코믹과 화려한 액션의 만남이라니..!,7
권상우 이민정 나온다고 해서 봤는데뻔한 내용인데 재밌어요ㅋㅋ권상우배우님 연기찰떡ㅋㅋㅋ,10
오랜만에 좋은영화를 봤다. ,10
원작에는 없던 송태섭의 숨겨진 가정사가 너무나도 내 살아온 과거와 비슷해서 애니 한편에 엄청나게 많은 감정과 생각에 잠기게 되었다.. 중학교 2학년 친형이 교통사고로 갑작스레 돌아가셨고 2년도 안되어 아버님도 충격으로 타계하셨던 내 과거에 대한 생각에 잠기게되어 영화가 끝나고 이루 말할수없는 여운에 스스로는 도저히 주체하지못할 감정에 휩싸여 주차장에서 너무나도 많이 울었다.. 단순히 과거 좋아했던 만화한편 보고싶어 향수에 사로잡혀 영화관에 방문했던 내게 남아계신 어머니에대한 믿음에 보답하며 살아야겠다는 다짐과 송태섭이라는 주인공의 열정과 투지에 앞으로 내 마음가짐을 다잡을수 있는 기회였던 작품이었다.. 모르겠다.. 나에게는 적어도 너무나도 와닿고 인생의 철학을 배울수있었던 작품이라고 생각이든다.. 감독과 제작사에게 처음으로 감사함의 마음을 가질수있었다..,10
연기 스토리 지림눈시울이..,10
왜 안떴는지 이해가 안가네요.,10
내 마음의 길은 어떨까?,10
가볍게 보기좋은 거 같아요가족들의 소중함을 일깨워주는 영화입니더만족스러웟습니다!,10
혼자라도 가서 봐야하나 고민한 내 자신 한심,10
배우들의 몰입된 연기와 역사적 배경을 가지고 다룬 영화다 보니 감동과 슬픈 분노 등 잊고지냈던 역사의 아픔을 저와 남편 아이에게 좋은 경험이 된 영화였어요 후반부에는 억지로 슬픈게 아니었는데 눈물이 멈추지 않았ㅇ요,10
부족한것이 하나도 없다긴장감. 감동 완전 만점,10
뮤지컬을 좋아하는 사람에게 추천할만함,5
모든 면에서 너무 좋앗어요. 다음편도 기대되네요,10
"장부가 큰 뜻을 품었으니, 하늘이시어 도와주소서.",10
평점도 높지않고 누적관람객수도 배우들 라인업에 비해 많지않아서 고민했는데고민왜했나싶어요진짜 따뜻하고 예쁜 영화예요 크리스마스시즌에 딱 나왔어야하는데ㅠ 아쉬웠어요고민하지마시고 얼른 다들 보세요 ,10
내가 액션에 너무 많은 기대를 했던 걸까...,4
아바타1도 그냥 그랬던 저에겐 아바타2도 그냥 보통이네요. 트랜스포머 처럼 CG만 화려한 영화였어요.,6
누군가의 망상속을 구경한다면 이렇지 않을까.,7
슬램덩크 산왕전을 잡다한 각색없이 마치 경기장에서 보는듯한 처리가 너무 신선하고 좋았고 안본사람들 보다는 본사람들에게 더 큰 감동으로 다가왔을듯 하네요. 송태섭이 풀코트 프레스 뚫을때 만화책에서는 그냥 그런 느낌이었다면 영화에서는 음악과 연출이 너무 생동감있게 다가와서 눈물이 나올뻔 했네요.. 슬램덩크 팬이라면 안보면 후회 합니다,10
"영화 내내 계속 울었어요,, 너무 슬프고 너무 잘 만든 영화",10
미신 홍보영화를 보는 느낌!!그냥 안타까움,2
나문희 마지막 서신.. 키야 ,10
"　　　　ㅤㅤㅤㅤ,.",1
장면 하나하나마다 원작이 떠올라서 좋았습니다…만제가 제일 좋아하는 장면인 “정말 좋아합니다 이번엔 진심이라고요”가 쓰러지고난 후에 나왔으면 바로 울음보 터졌을텐데 그 장면 자체가 없는게 너무나 아쉬웠고정대만이 내가 누구지 하고 나서 “그래 난 정대만 포기를 모르는 남자지“ 씬이 없어서 아쉬웠습니다…,9
처음 후기 쓰네요. 어릴 때의 기억을 눈 앞에서 멋진 영상으로 보고 왔습니다. ,10
이거 진짜 다봐야함. 어제봤는데 다음주에 또 볼거에요 뮤지컬요소 너무 잘살렸어요 10/1금액 주고 뮤지컬 한편 봄.. 솔직히 아바타 보다 훨씬 좋다 ㅠㅠㅠ 왜 안봐 이거 왜 안봐요 무조건 봐요 진짜 최고.. 여운이 가시질 않음 ㅠㅠ ,10
너무재밌어요 아이들도 긔엽고요 그러다 감동,10
7점대 영화일 리가 없다..,10
와 첨부터 끝까지 잼있게 봤는데 머이리 댓글엔 정치적으로 엮는 정치병자들이 많냐 ㅋㅋㅋ,10
치욕적인 역사를 감동적인 연출과 배우들의 연기력으로 다시 일깨워준 최고의 영화입니다. 역사를 잊은 민족의 미래는 없습니다. ,10
비싼 배우들 데려다 찍은 B급 영화,4
역시 1편을 넘는 2편은 없다.,8
"괜찮은 영화이지만, TV 드라마와 차별성이 별로 없어 아쉬웠던 영화",7
감독님 과거의 영광은 잊으시고 초심을 되찾으십시오 돈쓰는 사람들 생각은 안하십니까 너무 안타깝습니다,1
"조정석, 신민아 연기 자연스럽고 그런대로 재미있다. 전무송의 배역과 연기가 인상적이다.",7
좋은  배우들 모아다가 아깝다.,4
말이 필요 없습니다:),10
"영상미가 뛰어나요,또 볼수있어요",7
매력 있는 캐릭터들의  가벼운 스토리ㅎㅎ  잼나요,9
슬램덩크 처음봤던 과거로 잠시다녀온 기분이었습니다,10
나도 그들과 함께 그시절로 돌아갔다,10
좌충우돌 제이크네 이민정착기... 용아맥 명당에서 봤지만 글쎄... 와대박 소린 안나왔음,7
모두가 예상 못한 송태섭 시점의 스토리 전개와 모두가 다 아는 결말의 내용을 진부하지 않게 만들어 끝까지 몰입하게 하는 최고의 애니 극장판이었습니다. ,10
너무 울었어요ㅜ 휴지 꼭 챙기세요,10
이래도 안울어? 라는 뻔한 계략에이것봐라? 하며 맞서다결국은 눈물 흘림 당하고마는,4
한번 봤는데 담주에 가족들이랑 보려고 또 예매했어요.두번 세번 보고싶을 만큼 감동적이고우리민족 독립투사님들을 기억하고 감사할수 있는좋은 작품인거 같습니다.영화 대박났으면 좋겠습니다.,10
아홉 개의 목숨 중 단 하나의 목숨만 남은 장화신은 고양이,8
이렇게 대단한 영화를 왜 이제 봤지 가끔 케이블에 나오고 있어도 원숭이 영화네 관심 없어 하고 돌려 버렸는데 이제라도 봐서 너무 좋네,10
오정세 배우님 연기짱입니다,6
키아누bro 명작....dvd소장중....,10
스케일 큰 영화들도 좋지만 이런 소소한 영화들도 있어야지 재밌게 잘봤습니다,8
"말로표현못함.봐야알수있음.느낌, 감동, 뭉클 등",10
"기죽지마, 우린 할 수 있따",10
생각보다 재밌었는데 영화관에시 봤으면돈아까웠을듯..ㅋㅋ,7
"애니 안좋아하는데 딸이 넘넘좋아해서 많은 애니들을 함께 공유하고자 보고있는데, 넘 잼있어요♡ 고냥이들의 매력에 푹빠진 ..시간이짧게느껴졌네요.강츄!",10
원작을 달달외울정도로 봤습니다 머리속으로만 생각했던 경기플레이가 그대로 연출되어 놀라웠고 경기내용을 알고있지만 감동그자체내요지금 자막 더빙 2회차인데 몇번더볼지모르겠네요더세컨드~더피프스까지 나왔으면하는 바램입니다,10
매우 지루 설마 이게 다는 아니겠지 하다보면 끝남,2
후회없는 선택입니다 쵝오,10
생각없이 보면 볼만함 장르가 모호하긴함,8
9.11 테러로 희생되신 모든 분들 명복을 빕니다 ,10
최고다...ㅜㅜ 너무좋다.. 걍 모든게완벽함,10
마지막 10분간 아무도 팝콘을 먹지도 음료를 마시지도 숨을 쉬지도 않았다.,10
일본로맨스물은 다 비슷한대 재밌다 그 맛에 보나...?,9
기대보다는 좋았습니다,7
미친 수준의 영화..왜 이걸 지금 봤을까...,10
최고임더빙이좀더 정이감,10
최고예여ㅠㅠㅠㅠ 펑펑울었어여ㅠㅠㅠㅠ,10
"역시 재난영화에는 여자와 아이가 암덩이, 눈치제로 ",6
인생 영화중 하나입니다,10
꼭두새벽부터 봐서 피곤했지만 영상미로 눈이 즐거웠다,10
그냥 레전드다 이거 안보면 평생후회하게 될거야..,10
역사를 잊은 민족에게 미래는 없다,10
주지훈 왜이리 잘생겼나...,7
두 번 봤어요... 다큐멘터리 느낌,10
"펑펑 울었고요ㅠㅠ 재밌고 너무 아름다운 영화였어요 아바타1을 안봤는데 남편이 계속 보자그래서 어쩔수없이 보고 재미없으면 자려고 했는데 다음에 4D로 다시 보러가려구요 이게 평점이 이것밖에 안되다니,, 말도 안돼ㅠㅠㅠㅠ",10
귀여운데 재밌기까지~,8
"가볍게 볼 수 있는 영화…감동 재미 둘다 있고,인상 찌푸리게 하는 장면 없이 기분 좋게 볼수있는 영화",10
배우들의 연기는 훌륭하나 뭔가가 아쉬움...,6
무거울수 있는 스토리를 뮤직컬로 소화시킨 영화.배우들의 표정연기와 표현연기 경쾌함과 감동. 조국이 의미를 딸아이와 다시한번 생각 하게 만드는 영화!!,10
누구나 상상할 수 있는 일탈을 적나라하게 보여줌,5
펑펑울었네ㅜㅜ 휴~~,10
난 잼있는데2차 공격당하는 다음편도 나오면 참 좋겠다,10
진짜 슬프고 재미있습니다.,10
명작은 전개와 결말을 알고서봐도 명작.,10
진짜 또 보고싶다……..,10
오늘 그들과 함께했습니다. 행복했습니다.,10
새로운건 없지만 무난하고 따뜻하다.,7
아기키우다보니 감정이입이 돼서 그런가 사알짝 눈물이 고였어요 재밌게 잘 봤습니다 ^^ 요즘 영화 아바타다음으로 재밌네요,10
너무 별로였오용 잘 모르겠네용,2
배우들 연기에 비해 연출이 정말 쌉ㄱㅈ같네요 이게최선이었을까 정말 보면서도 의문이 드네요 그저 안타깝다는 말밖에… 그저 국군장병들 희생에 항상 감사하는 마음 가지겠습니다 ,2
소수의 악인이 다수의 인간을 불행하게 만드는 전쟁을 언제까지 방관할 것인가.,10
"참고 참았지만 끝내 눈물, 콧물까지 흐르게 만드네요. 용서하되 잊지는 말자!",10
뜬금포 같네요.포인트는 머라 말하기 그렇지만..,2
걍 최고의 영화 뭐 더 할말이 있겠나..그냥 보세요 ,10
1편 볼 땐 신혼.. 지금은 초중생 키우는 아빠.. 아들이랑 같이 봤는데 공감되는 부분과 재미있는 부분이 많았다 ㅎㅎ 영상미는 말할 것 없고,10
김독은 무슨 생각으로 이 영화를 만들었을까?,1
평점 20점은 없나?? 세월이 흘러서 이런기술로 박진감을 즐길수있다니 너무 감사드립니다,10
오  최근영화중 너무 좋았어요!  영상도 좋고 연기스토리  다 ,8
말이 필요없다. 시간이 걸려도 또 다시 갱신 할거다 ,10
따뜻한 영화네요.. 재미있게 봤습니다.,10
과거의 추억을 해치지 않고 오히려 완벽히 복원!!,10
예고편만봤을땐 이질감이 들줄 알았는데 직접보니 그렇지않더라구요. 이노우에센세 그림을 온전히 느낄수있는 작화라 너무 좋았어요ㅜㅜ 솔직히 송태섭 중심의 이야기 전개에 회상씬이 많아서 호불호가 있을거 같긴한데 북산5인방중 과거서사 안나온건 태섭이 밖에 없어서 팬아닌사람까지도 잡기엔 똑똑한 선택인듯. OST도 너무 좋고 몇몇 명대사가 빠진게 아쉽긴하지만 그것도 생각해보면 영상으로 나왔으면 잉?스럽고 오글거렸을거같아요ㅋㅋㅋㅋ 이노우에센세 센스 여전하십니다!! 꼭 보러가세요!!,10
한석규  연기는 클래식하다피시통신이 젊음이다,10
뻔히 예상되는 결말이 기다렸지만 그 과정이 상당히 흥미롭고 따뜻했다. 어른을 위한 동화 한 편.,8
 재미있게 잘 보았습니다,10
실화라는게 가슴아프고 감동을 주네요,10
정말 단순한 총질 이야기,4
음악이 나올때 마다. 가슴이. 뭉클해짐,10
슬램덩크 팬이라면 26년 후에나온 움직이는 그들을보며 전율할수밖에 없다,10
안중근에 가슴이 뜨거워지다 조마리아에 눈물이 쏟아진다.,9
최근 본 영화 중 최고였습니다,10
그냥 진짜 뭐 휴댄시가 정말 왕자님이다..ㅋㅋ 이런 스윗한 남자 세상에서 볼수나 있을까ㅎ 10년전에도 보고 요즘 또 봐도 정말 미소지을때 대박임 ,9
만화책으로 보던 추억의 슬램덩크 역시 너무 재미있었어요,10
"성룡 영화라는 프레임에서 보면 별로일수 있지만 홍콩 영화로선 좋았음. 90년대 홍콩 감성, 영상미 좋았음. 성룡, 양조위, 주성치를 한 영화 안에서 볼수 있어서 좋았음",9
영화보는 내내 처음부터 끝까지 울었어요. 우리나라의 독립을 위하여 힘썼던 분들을 계속 기억하였으면 좋겠습니다. 너무너무 좋았어요.,10
너무 재밌엇어요!! 슬펐다가 진심으로 응원도 하거 감동도 받고 뀰잼!!,10
후반에 나문희 배우님이 연기하실때 펑펑 울었습니다.. 와이프랑 보는데 도저히 눈물을 참을수없었네요..,10
넘 재밌게 봤어요 지루할 틈이 없을 정도로!,10
꼭 봐야되는 영화...천만 꼭 갔음 좋겠어요,10
ㅜㅜ배우들 연기에 감동받았습니다.눈물없이는 볼수없는 역사이야기...꼭보세요.휴지나 손수건 꼭 챙기세요. ,10
간만에 만족스러운 애니메이션 한편 봤다..액션이 정말빠르고 재미있었다..,10
말이 필요 없네요그냥 보세요,10
정말 말이 안 나올 정도를 놀라운 영화다. 기대했던 영화이기에 정말 놀랍다.,10
감사합니다 20년만에 날라온 큰 선물,10
간만에 한국 코믹 영화 걸작. 재미있게 잘 봤습니다.,9
첫 장면부터 눈물나긴 처음이에요 감동입니다 ,10
영상미들 뒤로한 개연성 없는 스토리,4
"대한민국 사람이라면 한번은 꼭 봐야 할 영화배우들의 연기력은 말할것도 없고, 뮤지컬 보고싶었는데 이 영화로 해결됐어요 담주에 한번 더 볼 예정.",10
눈물 훔치면서 봤어요! ,10
빨갱이 액션,4
"재개봉 또 안 하나요,, 재개봉 했을 때 극장 5번 갔어요 ㅠㅠㅠ제발 ,, ost 너무 좋아요,,",10
몇번이나 본 장면들 전부 아는내용으로 이런감동을 뽑아내다니 최고입니다. 자막판에이어 더빙판 2회차 가야겠어요,10
진짜 3시간이 하나도 안 지루했고 마지막이 꺽꺽 울었다 ..아들 돌려주세요 .. ,10
에메랄드빛 바다에서 수영하고 싶어짐. 내가 하면 개헤엄이겠지,10
재밌어요~국뽕이 차오르는 영화,10
기괴하고 심오하고 음 뭐랄까.. 전달하고자 하는 메시지가 무엇인지는 알겠으나 아직까진 내가 감당하기 힘든 수준의 영화,4
너무 재밌게 봤습니다ㅜㅠ슬램덩크 사랑해요,10
그들은 만화속 주인공이 아니라어느순간 내 친구가 되어 있었고정말 소삭이 궁금햇는데 다시 만나게 되어 눈물나게 반가웠다. 물론 언제 다시 또 만나게 될진 모르겠지만.  ,10
영화를 보며 잊고 지냈던 나의 기억이 떠올랐다...  영화를 보며 이야기 진행과 나의 잊고 지냈던 과거의 이야기가 오버랩되며 진한 감동이 몰려온다,10
