sentence,score
"완벽히 구현해낸 산왕전. 처음보든, 결말을 알고보든, 두세번 보든경기 끝자락엔 모두 손에 땀을쥐고 숨죽이며 북산의 농구 경기를 관람했다.전율!",10
그냥 무조건 봐야하는 영화 ,10
농담아니고 7광구를 보세요 차라리,1
보는 내내 긴장감으로 손에 땀을 쥐게 만들었다. 역시 믿고 보는 배우들의 케미가 더불어 영화를 완성했다.,8
이런 수준 떨어지는 영화 평점이 9점이 넘다니 ㅉㅉ,2
오랜 슬램덩크 팬들(만)을 위한 선물같은 영화,8
개발도상국에 살지못하고 높은 금리와 고령화시대에 맞서 싸우는 이 시대의 아버지에 역할에 대해 많은 명제와 책임을 주는 영화였다. 어차피 난 내 영혼에 툴쿤조차 없는 사람이었겠지만.,10
배우들의 연기력이 아깝다는 생각이 든다. 결국 무엇을 말하고 싶은건지.,6
아니.한10분 볼만한가했드만.. 드럽게 잔인하고 죽이고 피터지다 시간때우고 영화시간 종영 ㅡㅡ,2
편안하게 볼 수 있는 영화,7
딴건 몰라도 연출이 지림,8
그의 슬픔이 묻어나오는 영화인거 같다. 섬세한 표정 연기 속의 감정들을 읽다보면 아비의 모습이 아닌 인간 장국영의 모습인듯 보인다.,8
감동적입니다. 눈물 펑펑 쏟았어요ㅠㅠ,10
"가볍게 보다가 무거운 여운을 남기는 영화, 친일척결을 영화속에서라도 하게되어 약간의 마음이 풀린다 .  놀라운 연기력을 보여준 배우들에게 찬사를 보낸다. ",10
어떻게 그때이런생각을했을까,8
낯설면서도 익숙한 느낌,7
그러저럭 보통인듯함ㅋㅋ,5
재밌게본영화 심각하지않아서좋았던영화,8
그부모의 그 아들. 결국자본주의사회,8
재난영화 클리셰로 떡칠된 것까지는 참고 보겠는데진짜 주인공 가족들이 존내 답답함 진짜,2
감정은 강강강이고 개그씬은 뜬금스럽지만 그래도 폭풍 눈물...,7
"왜?.,.,.,.,.",1
처음부터 웅장하고 뭉클하고 죄송하고 미안하고.. 눈물 펑펑 흘리면서 봤어요.. 아무것도 도움 드릴수 없어.. 도와드리지 못해 너무너무 죄송하고 또 죄송하고.. 죄송합니다.,10
대단한스케일의영화,8
시나리오 연출 연기 의상 배경 모두 훌륭해서 직접 보지 못한 게 아쉬웠다,10
세상은 똑똑한사람보다 용감한사람을.더 필요로하는듯,9
"나를 포함한 모두가 숨쉬는것조차 맘대로 하지 못했다. 몰임감,,,그리고 몇번이나 울컥울컥…",9
"청춘이라는 주제를 고리타분하게 전달하지 않고 재미와 감동, 추리 등의 요소를 갖가지 섞어서 관객들에게 감동을 선사한 명작이고 개인적으로 어른제국의 역습이랑 거의 맞먹는다고 생각한다.",10
임시완의 유무로 나뉜다,10
아라시아라시포드림,10
인생 영화입니다오히려 둘이 안이어지는게 더 여운있고 아련함.꿈을 이뤄가는 과정이 아름다움꼭 보시길!,10
뮤지컬영화의 정답지,9
남자친구랑 봤는데 너무너무 재밌었어요!남자친구는 이런 종류 영화 안 좋아하는데도 생각보다 재밌었다면서 조금이라도 어렸을 때 봤으면 훨씬 더 좋았을 거라고 하네요~~ 완전 만족만족ㅎㅎ 그리고 페로 너무너무 귀여워요.. 보자마자 귀여움에 꽂혔어요ㅋㅋ,10
와우!! 스파이더맨을 찾는이유가 있지,10
운명..?만날사람은 만나게 되어있다는게 마음에 와닿네요 저는 20대초반 어린 시절 군대 휴가나와서 우연치 않게 만난 인연이있었는데.. 짧게 사귀고 서로 거리나 여건상 여의치 않아 헤어지면서 그대로 스쳐지나가는 인연인줄알았는데..5~6년이란 시간이 흐른 후 어떻게 연락이 닿았는데 제 지역쪽으로 이사를 왔길래 언제 만나서 밥한끼하자라 했던 말이...지금은 제 옆에 와이프가 되었네요^^ 운명..만날 사람은 만난다일까요..?기분 좋게 본 영화입니다~ ,8
배네딕트컴버비치만이 만들어낼수있는 닥터스트레인지,9
"새로운 배트맨 신작, 볼만함",6
오프닝 스케치 장면은 &amp;#39;악당 출현!&amp;#39;,10
아니 이영화가 80년대영화라고? 진심??,10
두근두근거려. 울려 심장박동. 째깍째깍에 맞춰 움직여. 오로지 들리는 건 내 숨소리뿐. 최고의 1분이었다 ,9
더노비스의 그배우였다니!,8
다이애나 비의 인생을 엿볼수 있는 영화라서 그녀가 얼마나 힘겹고 옥죄는 입장으로 살았을지 가늠이 되서 안타깝다. 며느리로서 살아가는 그녀는 행복하고 싶었고 자유롭고 싶었다.,9
멀티유니버스를 가장쉽게 설명해준영화,10
"감동적이고, 한국에서 흔치 않는 뮤지컬 영화인듯",7
명작입니다 보고 눈물 흘렸습니다 감동받아서 ,10
옛추억에 너무 재미있게 본 애니 추억속에 잠겨 다시 한번 가슴이 뜨거워졌다,10
"하아,.전쟁속사랑이야기인가..",8
아저씨들 한골한골 리액션하고 정적에서 중얼거릴거면 제발 집에서 혼자 보세요 영화 정말 좋았는데 아재들 개많아서 집중안됨...영화는 슬램덩크 자체가 빌드업이 굉장히 느리고 긴 만화라 2시간에 담을 수 있는 최선의 방법으로 담았다고 생각함...최선이지만 최고가 아니었을 뿐 너무 좋았습니다 작품성 걸출합니다 ,9
과연 옛날영화가 맞는가?,8
도대체 무슨 영화인지 모르겠어요.이 감독은 아마... 지금쯤 개인회생 절차를 진행중일거 같습니다...,1
"음, 뭐라고해야할지모르겠다.",5
"아,나는무서운건정말...ㅜ무섭다",8
47미터 복사판? 더럽게 개망작이네.. 후대폰은 3일밤낮을 영상보구해도 방전 안되는건 무엇이냐? 보기드문 개쓰레기영화네..,1
조금은 억지스런연기가 초반에 있었지만 진정성이 점점 느껴지는영화였다.,8
불매운동 잊었는냐?정신 차리자,1
개봉해주셔서 감사합니다,10
고무고무 루피...!! 근데 넘 게임스러웠다.,8
너무 진부하다. 스토리가 전혀 새롭지 않음,6
알고보면 뻔하지만 그냥 슬픈 영화,8
연기장인들의 놀이터,10
황정민이 계속 보여주던 연기와 이정재가 처음 보여주는 연기의 만남..,10
북산최고!! 너무 재미있게 봤어요. 생동감이 엄청납니다.,10
영화도 굿 OST도 굿.. 감동 그 자체!!,10
이걸영화관에서.다시볼줄이야,8
이 세상에서 전쟁이  사라지기를 소원하고 소원한다..,10
명작 오브 명작,10
"정성화 배우님의 가창력과 연기력은 말할 필요도 없을 만큼 최고였고, 김고은 배우님, 나문희 배우님 넘버에서는 눈물 주룩주룩 흘렸습니다. 뮤지컬의 1/15에 해당하는 가격에 이런 고퀄리티의 영화를 볼 수 있다는 사실이 너무 반갑고 감사했습니다.",10
다소난해했다 하지만 주인공의 결을 따라가는것도.좋았다.,7
주지훈 넘 잘생김 2탄도 나오나요?,8
사실 좀 의무감에 본 느낌이 있었는데 너무나 기대 이상이었음,8
그 지푸라기 때문에 가치 판단을 하지 못하는 인간의 본성,7
신선하고 흡입력있다. 근래 본 공포중 가장 잼잇다. 장르감안 평점 10점.공포 좋아하면 무조건 추천함ㅋㅋ,10
너무공감!!힘내자구요!!,10
미혼모 역할 너무 안어울리네. 지하철 탄거부터 안 어울렸음..,4
어떻게 이렇게 만들수 있지? 박찬욱이 경이롭다. ,10
평식이가 평점1점 준 영화다.무척 끔찍한 영화라는 뜻인데 평식이를 믿을수가 있나?(비웃음)마터스 원작 영화의 감독이 써준 각본인데 미국판 리메이크는 별로다.원작영화도 악취미다...,6
예상한 그것과 신선한 그것이 함께 오묘한 기류를 이루네요..,10
진짜 최고예요!!! 남편은 보면서 엄청 울엇어요.. 결혼하고 아이낳고 하신 관객분들 훌쩍 거리는 소리 많이 낫고 웃기기도 웃겨서진짜 제대로 스트레스 풀엇어요더더 흥행하길 바래요,10
추억이라기엔 이노우에다케히코는 아직도 불타고 있었다,10
뭔 말인지 알지? .ㅠㅠ,4
제일 소중한 건 늘 곁에 있어.익숙함에 가려서 보이지 않을 뿐이지.그러니 삶에 지칠 땐 그냥 현실을 즐겨봐.인생은 한번이니까.,10
연말에 개봉했었어야 한다 이건 기대 안했는데 아주 좋았다,9
크... 역시 슬램덩크 최고랍니다산왕전의 짜릿함!,9
올해 최고의 영화지 않을ㄱ핀,10
3시간을 봐도 지루하지 않음에 대단하다고 느낌과 동시에 이런 영화를 보는 관객이 있음을 감독은 감사해야할까? 아니면 관객이 감사해야 할까? 굉장히 지루함과 동시에 굉장히 널부러져있는 느낌이라 다큐를 보는건 아닐까란 생각이 들 정도그럼에도 보게 만든다 끝까지 보게 만든다. 어떤 방식으로든 재미있었다고 생각한다. 단순함과 지루함도 재미있을 수 있어요. 타인의 침묵도 가끔은 보고 싶고 듣고 싶어지는 것처럼,7
짜여진 코드 속에서 살아가는 NPC들보다 자유롭지 못한 내가 부끄러워졌다,10
울고싶은데 눈물이 나올 힘도 없을때마다 보게되네요,10
다른 부분은 호불호 갈릴지언정 오프닝은 진짜 탑급이었다,7
제이슨 본 씨리즈의 감독 폴 그린그래스와 포레스트 검프의 주인공 톰 행크스가 만나면 무슨 영화를 찍을것인가?보고 싶다면 필견의 영화다.아니라면?,9
29년 살면서 이렇게 재미없고 스토리 별로고 교훈도 없는 영화는 정말 살아생전 처음입니다…,2
28년 살면서 본 영화들중에서 가장 쓰레기 같은 영화 개연성 없이 갑자기 스토리가 산으로 가는 OOO기 분리수거도 안되는 영화 ,1
"양조위의 표정 연기, 텐 링즈 고유의 전투씬, 그리고 가족애..",10
감독이 신하균 주연 지구를 지켜라를 오마주한건가?? ㅎㅎㅎㅎ 캐릭터 배경설정이 재밌네. 그리고 스토리! 한 인간의 삶과 가족 관계를 어떻게 이렇게 기이하게 풀수가 있지? ㅋㅋ 근데 어누 미웃기고 공감되고 다들 연기 왜케 잘해ㅋㅋㅋ 그리고 넌 무엇이든 할 수 있대ㅋㅋㅋ 무엇이든 너무 못하니까ㅌㅌㅌ 웃겨웃겨. ,10
너무 재밌네요 연출을 너무잘했네요,10
많은 교훈을 준 영화입니다 ,8
완벽하게 다 구운 삼겹살에 뿌려진 와사비 한 통,5
인물들의 스토리가 재밌었습니다또 보고 싶어요,10
근래 본 한국영화중 최고였습니다,10
"체감상으론 영화가 1시간 보다  짧게 느껴졌고,관람하다 진심 심장 터질뻔했다.",10
한국의 다크히어로,7
슬램덩크는 단순한 농구만화가 아니다.농구를 좋아하든 좋아하지않든 모든 남자들의 학창시절이다.,10
마지막에 손에서 땀날정도로긴장했어요이미 다 알고 있는 결말인데도 말이죠역시 명작이예요,10
액션과 CG는 상당한데.. 스토리는.. 흠,6
두근했고 쩌릿했다... 아 역시 슬램덩크다...,10
툴쿤들 괴롭히지말라고~~~~아바타 이상하게 생겨서 1도안봤는데 2  보러가서 감동먹고옴,10
서로가 같은 곳을 바라보고 있었을 땐 나란히 앉아있지만 이젠 돌아갈 수 없을 때 서로 마주보고 앉아있는 것을 보고 가슴이 먹먹해졌다,8
10대때 소년챔프를 뒤부터 거꾸로 보게 만들며 설레임과 감동을줬고. 이번에는 다시 그설레임과 감동을  느끼게해준 이노우에센세 감사합니다~,10
깔끔한 전개에 간단하게 킬링타임으로 즐기기 좋은 영화,7
OTT서비스 영화 치고는 볼만함...근데 핀치 캐릭터 캐스트 어웨이에서 발전시킨거 아닌가?,8
"10대, 20대, 30대 다 봤는데볼때마다 느낌이 다르네요30대인 지금 보는데 눈물이 났던 건이번이 처음인것 같아요대사 하나하나 무슨뜻인지 영화도 온전히 이해 할 수 있어서 좋았어요지금까지 열번은 본것 같아요 이영화...매력적입니다 앞으로 몇번을 더 볼지 모르겠네요",10
조커와 함께 DC의 마지막 희망,8
뒤죽박죽이면 어때? 이게 내가 만드는 철학인데.,10
프랑스라서 가능했던 영화! 그땐그랬구나 놀랐던영화!,7
"뻔한 놀람 포인트와 결말, 깊이가 없는 공포영화.",1
유머도 넣어주세요 배트맨다음으로 어두운영화인듯,9
생각하지말고 그냥 보는 그대로 즐기면 좋은 영화,6
오랜만에 부모님과 함께 영화관 가서 보기 좋은 영화. 그래픽이 아름답고 굿즈가 이쁘다.,10
매즈매컬슨이 주인공인가 싶었던영화,8
코스믹 호러가 아니라 샘 레이미식 공포물로는 성공,6
콜린퍼스만 보고 본 영화!! 적당한 긴장감의.첩보물,8
2편은 실패한다는 공식을 깨버린 작품,8
다들 이리두 평점이가 박하누 ? 나만 재밋게 본거니 !,10
저가로 구현한 액션 cg 치고는 나쁘진 않았지만...,5
잊혀져가는 약시의식 다시힌번 돌이켜보았고 좀 아쉬운건 여주인공은 뮤지컬이니만큼 뮤지컬 배우가 했음..정성화의.노래는 김울림이 컷는데  여주인공의 노래가 좀 기슴에.와닿는게.억지 스러웠음,10
마음이 넘 힘들었던 영화,9
"뭔가 화려한데,,,이상하게 가슴을 울리는 충격이랄까,,,그런게 없네, ",6
실패하더라도 다시 도전하면 새로운 기회를 얻을 수 있다,7
마지막 블랙위도우 영화치곤 아쉬웠지만..있는것만으로도 좋아,10
어떻게이런생각을!!,8
보는이로 하여금 각자 영광의 시절로 돌아가게 하는 마법 같은 경험.,9
최고의 만화 슬램덩크농구가 하고 싶어요...,10
똑똑하지않은 모습에 감정이입된다,8
영화관이 아닌 하늘에서,9
사실 불륜영화아닌가싶다가도 탕웨이 박해일보면 그들의 사랑만 보인다,8
장시간의 상영시간만 감내할 수 있다면 괜찮은 영화입니다.,8
"너무 좋은 영화, 꼭 봐야 할 이유가 넘친다. 묵직하게 밀고 나가는 연기, 아주 좋은, 재미있는 영화.",10
2편은 좀더 빡세게 만들어주세요! 잘만든영화 아쉽지않게,10
"구미호와 관련된 몇몇 장면들과 설정은 지금 봐도 흥미롭고, 저승사자와 무당의 조합은 신선하고 재밌다. 하지만 전반적으로 어수선하고, 연기 수준은 들쭉날쭉 이며, 생각만큼 몰입되지는 않다.",4
개연성 없이 끝나버린 결말. 왜 쥬라기 시리즈는 1편 빼고는 다 망할까,5
배우들의 연기와 뮤지컬 넘버,7
"현대식으로 표현된 고대의 모습은 처음엔 재기발랄하고 흥미롭지만, 이후 진부한 캐릭터와 예측 가능한 이야기 때문에 점점 지루해진다. 거기다 대부분의 유머는 유치해서 그리 웃기지 않다.",4
잘만든영화.평점이해하기힘듬.구성연기헐리웃수준cg.재미까지있었음,10
와! 대단하다싶은 풍자,8
기다렸던 영화였고 괜찮았습니다.,8
마블이라는 좋은 소재로 망하기가 쉬운게 아닌데,5
이만큼 만들수 있으면 만들어봐 ,10
조금만 힘을 풀었음 괜찮지않았을까?,7
인간은 먹이사슬 제일 위에 있어 보이지만 더 큰 피라미드는 존재한다,8
생각보다 볼만했습니다.,7
남자의관점 그리고 여자의 관점,8
반복 반복 반복 찾아봐 분명히 있을 거야,6
현실에 치여 살아온 여주인공에겐 왕자님이 필요해,7
외국영화이기에 가능했던 설정. 현실과.동떨어졌지만 나이가 들어도 자신감있게살아야겠다 다짐하게되는 영화,10
후속편인데 재밌고 배우들의 연기력과 유머까지 다름 스토리도 좋네요.뻔한 해피엔딩이지만 킬링타임용으로 너무 좋음 ㅋㅋ,10
초기 마블 쌍두마차의 시작,10
그럭저럭 볼만했습니다.,6
"후, 우리네 슈퍼맘들을 보는것같아 맘이 아팠다.",9
"22년에 나온 애니하고 비교가 안되네요 최고입니다 감동, 개그, 액션 다 챙겼네요",10
애니에서는 느낄 수 없던 아스나의 감정선을 미토라는 캐릭터와 함께 더 깊게 이해할 수 있었던 극장판,8
재밌는데..6점대는 아니라고봄,10
너무 잘 큰 배우들과 더불어 떡밥이 하나하나씩 풀려갈 때 쾌감 쩔고 진짜 재밌음.,10
"영상미는 좋았음 3d로 봤다면 더 좋은 평가를 했을거 같은데 영상미! 좋았음 단지 그것 하나뿐... 서사나 연출이 1보다 아쉬웠음 1도 스토리는 카메론감독 전작인 타이타닉,터미네이터2같은 명작보단 부족했는데 이번작품은 참.. 아쉽네",6
이해는되는데 넘 나르시스트인거아닌가싶기도,8
라스트 20초동안에는 그 어떤 관객의 숨소리조차도 안들렸다..,10
여기보니 현빈 저기보니 다니엘헤니,8
개꾸르르잼 2편보기 전에 1편봤는데 넘 좋았음,10
"잘 만들었다 생각하는데 평점은 왜 이런지,, 영화는 영화인거고 옛날 작품에다 이런 평을 남기는 이유가 궁금하네.. 장혁, 수애는 물론이고 꼬마가 연기를 너무 잘하네요",10
남자판 마녀같은데 넘과하다,8
심플하면서 확실하게 드러나는 주제와 인생에서 중요한 것은 바로 옆에 있음을 상기시켜주는 영화,7
이조합을 언제또다시보리,6
"알고 있었지만 잊고 있었고, 김훈의 하얼빈을 읽고 나서 보니 영화에 더 집중하고 봤습니다. 많은 이들이 아이들 방학때 함께 보기를 추천합니다!!!",10
역시 박성웅 주지훈이네요 너무 연기 좋았습니다,8
배우진이 조금 아쉽지만 스토리는 탄탄,9
"예전에 만화책으로 슬램덩크를 읽었던 3?40대가 느꼈을 향수와 감동은 비록 느낄수없었다. 그건 그들의 전유물이니까...하지만 리마스터링으로 애니메이션만 접한 상태이지만, 코트에서 뛰는 5명과 충분히 공감하고 열정을 전달받을 수 있었다.태섭이의 가정사는 스토리만 보고 봤을땐 특별할 것 없다고 느껴질수 있었지만, 그것을 통해서 태섭이를 입체적으로 캐릭터로 표현하기엔 충분했다. 중간중간 각 캐릭터들이 각성?하는 부분도 한 캐릭터에 치중되지 않고 모두에게 집중할 수 있어서 좋았다. 그 외에도 음향의 조절을 통한 분위기 조성, 삽입곡 등도 여운이 남게했다.여러모로 좋은 영화였다.",9
솔까 이런스타일 영화 안좋아하는데좀 뻔하고 지루하다가막판 5분 나문희 할머니 노래하면서 연기할때와 참으려해도 눈물이 주르륵 진짜ㅜㅜ,6
"정적, 심장소리, 초침소리, 그리고 정적",7
덕질을 생각하게 하는영화,8
앗 쿠키씬을 놓쳤다. 다시 보러 가야지. 음악에 심장도 뛴다. ,10
기대 안했는데 생각보다 재밌게 봤네요,8
이럴꺼면 이제 그만하자.,6
무난하면서도 깊게 다가오는 영화,7
다시보는데 넘 감동이고 넘 대단한 영화,10
다큐인데 돈 많이 쓴 다큐,7
당연히 재밌는 영화,7
어릴때 보던 추억이 새록새록…ㅠㅠㅠㅠ 근데 이렇게 감동적인 만화였을줄은 정말 몰랐다 나이가 들어서야 더 이해하게된다. 다만 평점은 현실화를 위해 8.9점 정도가 될때까지 맞추겠음..,6
미투.그 이후라...,6
갈 수록 삽을 푸는 마블,6
이거 어린이 영화야?이 좋은 감독님이 왜 고급인력들을 데리고 이런걸...이건 새로운 시도도 뭣도 아닌듯..돈만 날림...2부가 나오긴 해??전우치는 재밌었는디..아쉽다..바뻐서 극장가서 못봤는데 잘한듯..,2
제목과 반대로 굿 가이즈,7
한스짐머가 다한 영화. 그래서 언제 2나온다구?,10
재미있게 잘 관람하였습니다.,9
꼭 3D로 보시길 아무리큰 티비로도 절대 따라올수없는 감동입니다 월드타워롯데 21관 추천,10
시리즈가 갈수록 시간이 갈수록 졸리다.,3
재난영화인줄 알고 봤다가 황당해지는 영화 ㅋㅋ살다살다 내가 다 평점을 남겨버리네 ㅋㅋㅋ 너무 열받는다 진짜,4
진짜 어떻게 이걸 만든거지?,8
설경구는 역시 믿고 본다.,8
여운이 많이 남아요.눈문콧물 범벅.손수건 필수입니다.,10
나나 맞나싶을정도의 연기력 김윤진과 소지섭의 창과방패와 같은연기,10
cg의 끝판왕 이보다 잘만든게 있을까 싶음,10
긴장감에 앰뷸런스 불러야겠네.,6
오프닝만 볼 만한.,5
볼만한데 평점이 왜이럴까?,8
조금 따라가기힘들었던 영화,6
너무 재밌게 잘봤습니다 인상적인 장면 그리고 연출이 너무 많아요,8
배우들은 감독한테 무슨 죄를 지었길래...,1
초반부에 귀여워서 웃다가 후반부에 눈물 펑펑 나왔다 지나간 시간에 후회스러운 일들도 즐거운 일들도 모두 청춘이라며 따뜻하게 위로해주는 기분이었다. 짱구 최고!,10
공포영화보다 무서웠습니다 요리 영화인줄 알았는데 아니였네요ㅠ,9
잼있는데 유머코드가 살짝 어긋난느낌,7
까메오가 가장 재밌는,6
언브레이커블-23아이덴티티-글래스,10
샹크스 너무 멋있고 노래 너무 좋아서 하루종일 듣네요,10
다음 편을 더욱 기대케 하는 장엄한 전투와 서사,7
보고.또 본 영화! 아름다운 노랫소리,8
구성 영상 연기 음악 모든게 완벽 그 잡채,10
스토리랑 개연성은 진짜 1도 일관성 없고 개판이고억지 너무 심한데 신파에 슬픔 이끌어내는것만은잘했기 때문에 그나마2점 줌,2
시작하고 끝날때까지 숨쉴틈없이 지나간거 같아요. 30 40대 남성분들 뿐만 아니라 누가봐도 감명깊게 볼수있도록만든 이노우에에게 찬사를,10
이기적인 나르시스트의 삶?단지 시대를 잘못 타고났던걸까?,7
대사 하나하나가 소중하네요 좋았습니다,10
페넬로페 크루즈가 넘 예쁘다는 생각만 가득,8
개인적으론 최고였다.. 가족 버튼 건들여서 눈물 줄줄 ,9
조금은 가볍게 만들어도되지않을까?,8
베네딕트는 잘생겼다. 그리고 마냥 귀엽지만은 않은 고양이그림.,8
제목이 이상한 영화 크게 인상 깊은건 없었네요,6
기집마냥 펑펑 울었다…,10
잊혀지지않길바라는 영화. 아니 사실.,8
배우분들의 연기가 미쳤어요 몰입 잘됨,10
아쉬웠던 영화 넘 밝지도 어둡지도 않은 색맹이보는 세상같은. 그리고 감독이 바라보는 현시대의 가족상.,8
최고다.  새로운 마인드로 다시 살게될것!,10
마지막에 유지태가 보고싶었다.,7
너무 긴 러닝타임이라 지루할지라도 노래는 레전드,7
마동석도 이렇게 가다간...,4
"보는 내내 졸았어요같이 간 초6은 잼있었다는 걸로 봐서 초딩영화인가보다 했더니,그러기엔 또 관람객수도 너무 적네요아무튼 돈 아까운 영화!",4
반가운 사람들이 나와서 너무 행복했어요,10
나도 누군가의 딸이지...,8
"현빈과 다니엘헤니 김삼순 이후로 함께 나오는거 봐서 넘 좋았고, 현빈오빠 북한말 할때 특히 더 멋짐 폭발!!! 잘봤어요~~~",10
역시 트리거네요 꿀잼 주인공 마음에 듬,10
탐크루즈..영원하라,10
진짜 말 그대로 비상인 영화.,4
누가 누구를 사냥할까.,6
배우가 매력있고 신선했어요,7
원래 이렇게 귀여운 미니언즈였나???,10
우주속에서의 인간으로서는 넘어설수없는 절대고독   아무것도 없는데 완전하다 ,9
두 시간 넘게 보는 것이 진정한 공포.,6
그 시절의 풋풋함이 폴라로이드 사진 한장처럼 찍혀있다.,8
한국에 온 것만 좋았다.,5
멀티버스란 소재를 잘 활용함 스토리도 넘 좋았구,10
막판에 살짝 과하다는 느낌이 있었지만 청량했고 풋풋했고 순수했다,8
넷플렉스에서 영화 봤음죽을때까지 저 감독 영화 안 볼 것을 맹세함,2
새로운 시도는 인정.,7
재개봉으로 오랜만에 봤어요. 알라딘 ost는 언제들어도 좋네요,9
귀여움으로만 승부하긴 아쉽다.,6
나탈리포트만에 의한 여성도 액션할수 있음을 보여주는 영화 마블,8
"영상미는 조금 떨어질 수 있으나,안중근 이라는 인물이 가지는 상징성을 생각한다면 다른건 중요하지 않다고 생각합니다. 최고였어요",10
내일 모든 걸 잊는다 해도 가장 행복한 오늘을 줄게,10
영화관의 존재 이유란 이런 것,9
초반은 괜찮았는데 후반에 꼴아박네요 아쉽습니다,7
돌비 시네마에서 본 게 후회스러운,4
그저 박해일이 좋았고 그저 이순신이 좋았다.,10
그 따따닥하는 소리와 음산함은 기괴하고 무서웠다,8
애매하기만 하고 웃기지도 않네요,1
만화가 줄 수 있는 최고의 감동이 아닐까 ㅠㅠ,10
"이정재,정우성 배우님이 주연이라니. 스토리나 연출이 좋아서 관람후 더 만족했던 영화",9
애런존슨만 보였던 영화! 그치만 넘 서양인이보는 일본이라 아쉬웠다.,8
ost 미쳤네요 너무 감동적입니다ㅠ,10
