sentence,score
하루도 이 숭고한 희생을 잊지 않으며 살아가야겠다고 다짐한 영화.,10
"쓰레기,,,,7??)7",2
ㅜ...진짜 감동입니다 ㅜ다들 보세요 ㅠ,10
돌비로 봐서 사운드도 좋고 그림도 너무 좋았는데 편집이 너무 별로야 ㅠㅠ편집이 정말 그지 같애 흐름이 너무 끊겨,6
&amp;#34;너 착한놈인거 안다. 그러니까 내가 너 죽이는거 이해할 수 있지?&amp;#34;,8
기대 안 했는데 재밌다.. 페리토 너무 커엽,10
"거대한 산왕과 부딪치며 하루하루 살아가는, 당신의 삶에 대한 따뜻한 위로#슈밤 (슛 쏘고싶은 밤)",10
아바타2보다 재밋다. 원작의 감동을 다시한번 느꼇다,10
영화에 개성이 없습니다,4
"봐서는 안되는 영화, 감독의 중요성을 말해주네요",1
시나리오가 이상함.연기도 수준이 낮음.,5
다케이코 이노우에가 처음부터 이 영화를 위해 슬램덩크를 만든거 같다!진짜 어마어마 하다! 어제 봤는데 아직도 가슴이 웅장함!,10
과거여행일줄알았는데 ..현재였다,10
잔잔한 갈등과 절정으로 인해 2시간내내 마음편히 볼수있는영화,8
전율의 경기를 다른 화자의 시점들로 멋지게 그려낸다.,7
슬램덩크 팬이어서 거의 아는 내용임에도 움직이는 만화책을 보는 듯한 느낌이 납니다. 그만큼 원작을 잘 살렸습니다. 돈 벌기 위한 애니메이션이라기 보다는 다케이코 이노우에작가님이 선물 주신 느낌! 개인적인 생각입니다.,9
"영화 개봉 당시 혹평일색이라... 잊고 있었는데, 넷플릭스 뜬 거 보고 &amp;#39;이걸 왜 극장에서 안 봤지?&amp;#39;란 의문이 드는 영화ㅠ 2부 완전 기대하고 있습니다!!",10
초중반만 잘 넘기면큰거 한방이 있는영화..,8
"눈물은 기본이요, 먹먹함은 덤이요, 안중근 의사의 유골이 고국으로 꼭 돌아오기를 기도합니다. ",10
딱 9.5점이 어울리는 영화,9
날은 너무 추운데..농구장엔 눈과 얼음이 하얗게 쌓여있는데..안선생님..농구가...농구가 하고싶어요..ㅠㅠ,10
"결말 다 알고 보는데, 감동이 계속 되는 이 기분 ...동시에, 20년전 친구들과 농구하면서 함께 읽었던 이 책이 생각나서 눈물이 고였네요.이렇게 다시 볼수있어서 행복합니다.",10
마지막 친구의 대한 찬사의 언어들이 너무 좋았다.,10
호불호가 많이 갈리는 영화라 들었지만 너무 좋았습니다 연출도 스토리도 예전 천만을 넘았던 감독의 전작들 보다 더 좋았습니다 ,10
시작하자 울고 나올때 또울고... 근데 우리가 알던 울보 소연이는 어디간겨ㅜㅜ,10
 얙션영화의 하이라이트씬인 마지막 액션에서 갑옷도 아니고 왜 두주인공에게 재킷과..넥타이를 계속 입힌건지..그나마도 현빈은 마지막에 넥타이를 다친손에 감는듯했는데 편집도 엉성하고..다이하드와 007을 아주 살짝 따라해보려다 깜빡한듯..,4
코믹 요소는 두어번쯤이면 되었을텐데...2시간 내내  편집된 하이라이트를 보듯 자연스럽지 못한 건 뮤지컬이 원작이는 한계를 보여주는 듯하다. 웅장함과 비장함은 시작과 끝이 인상적이다. ,6
보는 내내 네가 보고 싶었다,10
함께 국토대장정을 한 것 같아서 좋았고.. 이승하 &amp; 한성천 에피소드가 있어서 지루하지도 않았다.. 대한민국 모든 배우분들.. 화이팅~!!,10
내가 본 영화중 가장 명작이라고 생각되는 작품.,10
연기에 감탄하고 노래에 감동하고! ,10
진짜 원래는 남주 얼굴 때문에 봤었는데요 너무 재미있었습니다,10
버릴 장면이 없음 10점이다,10
몰입해서 보기 좋은 영화입니다.,10
가족이란 말로 꾀다,9
너무재밌는데ㅠㅠ 꼭보세요!!!!,10
이런 식상한 소재 이제 지겹다 억지식애국영화,2
말로 표현할수없는 감동 대한민국 사람이라면 전국민이 다봐야할영화 완전 강추 입니다. 왜 이제야 봤나 후회 엄청 하고있습니다. 다들 늦기전에 어서 예매하시길!!!,10
20년이 지난 명작이 영화로 다시 만들어졌다,10
"어릴적 도서관에서 읽던 감동을 영화관에서 느끼게될줄이야,, 최고입니다.",10
난 뭔가 제목때문에 오히려 기대치가 낮아서 그랬는지 생각했던것 보다 훨씬 재미있게 봤음.대한민국에서 이런 블록버스터 SF영화를 만들었다는게 자랑스럽고 한번도 시도 해 보지 못했던 새로운 장르의 영화인데다 스토리 자체도 짜임새 있어 좋았음.다만 전우치 감독님이다 보니 특유의 색깔을 못버린 듯한 연출도 보였지만 한국 고유의 장르를 융합시킨 새로운 퓨전 스타일의 영화라 240분 내내 시간 가는 줄 모르고 봤다. 하필 토르랑 같이 개봉하는 바람에 관람객 수가 심하게 낮지만 지금 나왔으면.. 600만 정도는 볼거 같은 영화임. 1부의 참패를 2부에서 작품 완성도로 만회 해 주셨으면 하는 바람이다. ,10
기대치가 높았는지 중간에 너무 너어어무 지루했다...,4
안중근의사는 정말 훌륭하신분이예요 그분이 대한민국으로 오실수있도록 함께 노력하고싶어요,10
재미보단 감동과 색다른 결말까지..,8
최악 최악 최악 최악 최악 ,1
세상에,10
"개봉날 봤지만 여운이 가시지 않음. 스토리, 작화 뭐 하나 빠지지 않는 명작을 다시 만나니 아재들 환장할 수 밖에",10
"인생 영화, 꿈을 이루고 나니 또 생각이 나는영화",10
연기도 감동도 OST 최고,10
영화 자체는 중반 이상까지 계속 좀 발암이고 견디기 힘들고 그렇게 웰 메이드가 아니나 이성민의 진짜 이를 악문 혼신을 다한 연기. 코믹지수는 매우 낮은 편. 무표정 관람 가능. ,7
"기대를 많이했는지 지루했고 탕웨이 발음을 못알아듣겠어서  중간에 자막  키고봤어요 흠, .실망이요",2
정말 대박입니다.방금 영화관에서 보고왔는데 너무 감동받아서 눈물이 나왔네요.,10
가족의 소중함을 알게해주는 영화~ 우리 3식구 아빠가 행복하게 해줄게 ♡ ,10
쪽바리 이 개 시불것들..,10
"슬램덩크를 이노우에가 감독까지... 우리 세대라면 당연히 만점은 기본 ..스포츠 영화,만화 통틀어서 스포츠 경기를 가장 박진감 있게 그렸다. 스포츠 자체의 박진감을 느낄 수 있는 장면 연출. 만화적인 과도한 연출이나 쓸데없는 슬로우모션으로 경기를 맥빠지게 만들지 않고 경기 자체로 박진감을 느끼게 만든 연출. 이미 다음 장면을 아는데도 빠져든다 .. 최고 ~~!!",10
처음부터  끝까지 가슴이 벅차고 눈물이 마르지 않는다,10
"처음부터 끝까지 저질스러운 유머를 펼치는데 참고 보기 힘들고, 제목 그대로의 완성도를 보여준다.",1
아바타3에는 어느 지형을 테마로 할지 몹시 기대됩니다,10
진짜 미쳤어요.... 애니 영화 그 이상으로 작품이자 추억복기에요ㅠㅠ특히나 제 원픽 송태섭 서사여서 더욱 감동...울 줄은 몰랐는데 울었어요...ㅠㅠ 남친은 슬램덩크 10번본 애독자인데 너무 재밌었데요.. 영상미도 환상인게 예고편이랑 완전 달라요예고편만 봤을 때에는 약간 이질감 느껴진다고 생각했는데진짜 생동감있고 CG가 아니라 펜 선이 살아 숨쉬는것 같은느낌이랄까요?게다가 산왕전 시합때는 정말 박진감 넘치는데 음악이 한몫합니다.조용하다가 빠른비트와 함께 농구장 바닥에 빠르게 운동화 끌리는 소리..진짜 예술이에요... 이건 꼭 봐야해요...,10
강남역 주변은 초반만 잠시 나오는 듯? 걍 난 좀 비(추) ,3
어릴적 만화원작을 보며 느꼈던 감정이 되살아나 뭉클했습니다. 여운이 한참동안 가시질 않네요. ,10
조금 유치할 수 있지만 존나 움 ㅠㅠㅠ,8
어떻게 이걸 표현해야 할까요? 수백번도 넘게 본 산왕전이지만...이렇게 숨도 못 쉬게 만들고 눈물 고이게 만들 수 있을까요? 거기에 송태섭의 스토리가 합쳐지니 감성까지 가득.... 만화 영화인데....극장 또 가고 싶게 만들 줄은 몰랐네요....경기 마지막 1분은 정말 말 그대로 숨죽이고 본 것 같네요. ,10
중간쯤부터 끝까지 울면서 본 영화,10
마지막 경기장면 적막 연출은 꼭 극장에서 보셔야 압니다꼭 보셔요,9
마지막 경기장면 적막 연출은 꼭 극장에서 보셔야 압니다꼭 보셔요,9
마지막 경기장면 적막 연출은 꼭 극장에서 보셔야 압니다꼭 보셔요,9
마지막 경기장면 적막 연출은 꼭 극장에서 보셔야 압니다꼭 보셔요,9
제 앞에 50대로 추정되는 아저씨 2시간 내내 울면서 보셨습니다.,10
스토리가 엉성하다고해서 기대를 조금 내려놓고 관람했는데 의외로 재미있었습니다추천,10
내 심장을 다시 뛰게 해주는,10
"미쳤다…………,.,..",10
재밌었음 이게 왜 5등인지 이해안감,10
넷플로보고 너무 심해서 평점보니 알바심하게썼네요.. 최악의영화입니다,1
어른이 왜 사과를 못 하는건지..,8
"오랜기간 기다려온 팬들을 위한 너무 강력한 선물 무슨말이 필요할까..? 자막,더빙 둘다 즐기는수밖에..!! 그 어떤 기다림도 아깝지 않은 보상",10
여운이 길지 않아서 좋았습니다.  ,7
영상은 좋다..큰 화면에서 보면 좋은 영화..하지만 굳이 시간내서 볼 영화는 아닌듯,5
2009년에도 너무 재밌게봤는데 2023년에도 너무 재밌게봤어요! 영상미가 너무 이뻐요.. 첫째가 죽어서 너무너무 슬프구요ㅜㅈ판도라 부족들 모두 행복했음 좋겠다..,10
최고  산왕전의 살아움직이는 강백호를 볼수있다는것만으로도 감동,10
이건 현 시대를 살아가는 사람이라면 그냥 무조건 한 번 봐야되는 그런 영화다,10
탄탄한 스토리를 바탕으로 해서 그런지 몰입해서 봤습니다. ,10
아 진짜 너무 재미없다...,1
지금 다시 보니까 성우진이 엄청 나네,10
"영상미,ost,소재 다 좋았고 심지어 전달하고자하는 의미마저 좋았지만 감정이입을 깨버리는 급전개 때문에 모든것이 마이너스 된 느낌",3
나바족은 채워줄 수 없는 것들. ,10
뭔가 좀 자연스럽게 흘러가는것이 없지 않았나~그래도 잘봤어요,10
"내 인생 추억을 다시한번 꺼내준,,, 최고",10
진짜 재미있게 잘 봤어요~~~ 권상우 이런 연기 너무 좋아요! ,10
"무난하고 애매하다.감동, 유머, 연기 등 모든 요소가 골고루 어정쩡한 느낌. ",6
국뽕으로도 채울수 없는 뭔가 모자람,6
재밋엇다 또 보고싶다 !!,10
가슴이 따뜻해지네요. 바쁜일상속에서 나의 빛바랜 추억을 되새김질해줄 동기를 부여하기에 충분한 영화였어요.,10
정말 너무나도 감동이었습니다 열연해주신 배우분들 정말 감사합니다~♡,10
아 진짜 너무 재미없다… 이런 영화가 680만이나 극장에서 봤다고?… 대단하다… 와… 졸작이다.. 검사외전이랑 오버렙 되네…,2
킬링타임용으로 적합하네요,7
너무 재밌었어요!! 최고!!! 강력 추천!!,10
걍 미쳤다.무조건 4d로 봐야한다,10
그저 추억팔이가 아닌 나이가 든 팬이 이제는 이해할 수 있을 것 같은 감정을 포함해서 만든 영화,9
난 20대에 이작품을 처음 봤었지만.. 그때 당시 솔직히 말해서 마지막 장면에서 눈물이 나왔다. 몇년뒤 은행나무침대라는 한국작품을 봤을때.. 어..어.. 이거 진용 느낌난다 생각이 들었음. 내인생에 영향을 많이준 영화였다. ,10
오 이정도면 최고인거아닌가요오오오오,10
계속 나왔으면 좋겠음ㅁ,10
과거의 추억을 그대로 되살려준 영화,10
"사춘기 딸들이랑 봤는데 애들도 완전 재밌다고!!오프닝에 베이스, 드럼 음악 깔리고 인물들 한명씩 그려져 나올 때 가슴 터지는줄ㅜㅜㅜㅜ",10
뮤지컬영화라 더 가슴에 와닿으며 감정몰입이 잘되었어요. 며칠째 영웅앓이 중입니다^^,10
그냥 개지린다,10
너무너무너무 재밌고 보는 내내 행복했습니다,10
쓸대없이 테러범이 빨리 뒤짐 ㅡㅡ,2
진짜 최고의 영화입니다. 꼭 보세요.저는 또 보러 갈겁니다,10
마음이 아프고 아려서 계속 울며 봤어요. 많은분들 특히 학생들이 보아 주면 좋겠어요.,10
"미쳤습니다.OsT , 연출, 스토리 이게 스램덩큽니다.",10
중국영화....? 모야이거,1
재밌는데~ 평점낮아서 안볼라다가 봤는데~ 완전재밋던데~~ 왜평점이낮지? 재미있게봤어요~~,10
올해가 시작된 지 며칠 안됐지만 내 장담한다.이 영화는 올해 최고의 영화이다.그럴 수밖에 없다. ,10
이 영화를 천만 명이 봤으면,10
"너무길다,지루하다.",6
명작은 영원하다!!!,10
재미있게 봤다는 말조차 안중근 선생님께 죄송할만큼 너무 슬픈 역사여서... 가지고 들어간 티슈가 모자랄만큼 많이 울었습니다. ㅠㅠ 뮤지컬도 본 사람으로서 OST 너무 좋았구요. 김고은님 정말... 대단한 배우가 되실거예요. 나문희 배우님땜에 꺽꺽대고 울고... 이 영화는 재미를 논하기는 너무 가슴이 시린 내용입니다. 중고등학생 분들은 꼭 보셨으면 좋겠어요.,10
넷플에서 봤는데 너무 재밌게봤음 하도 재미없다고 그래서 재미없을 줄 알았는데 우리 가족은 엄청 재밌게 봄 초반 평점 약간 물타기였나 생각이 들 정도..? 이럴거면 영화관에서 볼 걸,10
"가슴을 저려오는 감동으로 첫장면부터 뭉클한 마음에 너무 슬프더라구요 ㅠㅠ 안중근 의사 영화가 할리우드 영화, 일본 애니에 밀리는 것도 정말 너무 가슴아파요ㅠㅠ 너무 감동적이고 한국인이라면 꼭 보고 마음에 새겨야하는 영화라고 생각합니당!!",10
스고오이~대단해데스네~,10
톰 크루즈 액션 영화 좋아하는데 이건 별로였습니다. 톰 크루즈를 보면서 멋있다는 생각이 아니라 유치하고 뻔하다는 생각만 들었어요.,4
스토리를 다 알고 보는데도 굉장히 재밌었습니다 강추합니다,10
역시 영상미가 대단한 영화였지만 영상미를 빼면 조금은 아쉬웠던 영화. 1편의 충격과 재미에는 못 미쳤다.,8
중2때 만화방에서 이 책을 보던 나의 모습이 떠올라서 가슴이 벅찼습니다. 최고입니다.,10
내러티브가 연기를 씹어먹는다,10
최고의 영화 잘 감상했어요^^,10
"죄의식을 잊지 못한 소녀, 증오와 공포로 계모형 동화의 정통을 잇다. ",7
두 여주의 연기가 엄청나네. 나는 니들과 달라 하지만 현실은 그들보다 형편없는 헤세와 가식이 가득한 빈 깡통같은 삶은 재스민의 인생을 갉아 먹는다.,6
남자주인공이 잘생겼는데 이야기를 끌고 가는 역활이라 잘 봤습니다. 강아지도 너무 귀엽고요. 다만 여주인공의 약혼자 설정은.. 그저 바람바람이네요 ,4
애국심 하나로 본 영화배우들 연기가 너무 좋았지만연출이 말아먹음이 좋은 소재와 명품배우들로 좀 안타까운 영화,4
탱고장면도 유명하지만 슬레이드의 관점이나 이야기는 상관없고 가족들이 그를 방치한것과 그런 주인공의 이야기는  누구든 말이없네요 ,10
 지금 다시봐도 촌스럽지 않은 명작,10
서정적인 어른들의 동화.사람은 어디서 와서 어디로 가는가? 잔잔하면서 서글퍼진다. 그리하여 그들은 오랫동안 행복하게 살았다.,6
시간 가는줄 알고 봤어요..,1
10 편 20편 100편 계속해주세요,10
뻔한 스토리에 단선적인 악역과 오글거림까지 거기다 남자미모로 승부거는 영화라 특히 남자들이 보기 괴로운 영화 평점 5.9,6
1편은 진짜 재밌었는데...신파에 극우에 국뽕에..에휴 다음 편은 뭐냐? 킹스맨 화이트 에이젼트 인종차별이냐?,2
개오글거리는데 끝까지 다봤네?,6
방금 가족과 함께 관람하고 왔습니다..아직도 여운이 남네요..최고입니다..,10
"뮤지컬을 영화화해서 더욱 웅장하고 큰스케일로 만들었고,  게다가 쉽게 다가가 볼수있게  영화화 해줘서  보는 내내 감사하며 감동 백배 느끼며 감상할수 있었습니다.오래전 윤석화님메인의 명성왕후 오리지널 뮤지컬을 너무 감명깊게 봐서  여러번 봤던 기억이 나네요.사실 뮤지컬만의 호흡을 느끼는 실감적인면이 커서 영화와는  충분히 다르지만 뮤지컬은  접하기가  생각보다 쉽지 않았거든요.영화로 아이와 보러갔는데,모두의 노래도 훌륭하고 또 보러 가야 할거 같습니다.영화관에서 할때 .",10
"- 첫 뮤지컬 영화였는데 뮤지컬 영화의 매력을 알게됨- 배우들 노래, 연기실력이 매우 뛰어남- 다 알고보는 역사영화지만 다시봐도 감동적이고독립운동가분들의 노고와 희생에 영화 시청 후에도 감동의 여운이 가시지 않음- 바쁜데 시간내서 영화관에서 보고 오길 참 잘했음- 무조건 추천합니다 꼭 영화관에서 보세요",10
시작부터 끝까지 감동에 눈물을 참을수 없었다.그리고 집에 와서는 엉엉 울었다.,10
대한독립만세!!!!,10
진짜 인생영화! 휴지 챙겨가세요,10
감독의 입맛이 너무 들어간게 아닐까원작을 재현하는건 원하지 않지만 너무 맘대로 바꿔버린듯 하다,6
미스와이프2  라고 해도 될듯,6
너무 재밌었고 지루하지도 않고 내용이 신선해서 보는내내 기분이 좋았습니다 개인적으로 너무 재밌게 봤습니다,10
3% 보다 더 적은 확률이어도 좋아 보고싶어,10
재미는 있었지만 굳이 새로운 서사를 끼워 넣어야 했는지는 의문,7
기억을 지우고 처음 봤을때 기분 느끼고 싶다..,10
재밌는데 평점이 왜 이렇지?,10
생각보다 재밌고 감동적인데 뭔가 아쉬움ㅠㅠ 더 잘 만들 수 있을 것 같은데,9
고퀄리티 영상으로 보는 산왕전은 뭉클하고 울컥하게 한다. 허나 반복되는 플래쉬백의 송태섭 가정사는 템포를 늦추고 루즈하게 한다,7
너무 긴장감 잇어요 잼있습니다,10
슬램덩크 광팬으로서 행복했지만 여친 눈치 보이는 2시간이었습니다. 사전지식 없으면 노잼,6
역시 긴장감과 감동 영상미 모두 만족하게잼있습니다.3탄이 기대되네요,10
가슴이 뜨거워지는 영화입니다. 안중근 의사의 유해를 찾는 그날이 꼭 오면 좋겠습니다. ,10
마지막 하이파이브까지 영화 내내 가슴이벅찼다 ,10
생각보다 재미있었고 신선했다. 우주와 달에 대한 새로운 상상력이 돋보였음.,8
그래서 아바타3 개봉 언제하냐구요ㅠㅠㅠㅠ,10
슬램덩크가 내인생의 전부였던 시절이 있었다.잠시 나마 그때로 돌아가게 해줘 고맙다.,10
치사량 낭만을 세시간이 넘는 시간동안 천천히 주입함 영화가 끝나갈때쯤은 넋 놓고 보고있게 됨,9
이런영화가 천만인은 봐야 하는데 상영관수가 적은게 안타깝네요,10
김고은 노래 너무 못함. 고음불가. 삑사리계속 남.노래 듣는 거 괴로움 ,4
글쎄 저번 토르부터 잘 땡기지 않게 된다.,7
남주 얼굴이 살림 눈물 하나도 안 나고 여주 친구 분량 너무 많아서 좀 아쉽,6
시간아까움.. 인생 최악의 영화 2호,1
남주 얼굴이 살림 눈물 하나도 안 나고 여주 친구 분량 너무 많아서 좀 아쉽,6
만화를 보신 분도 안 보신 분도 모두 몰입해서 볼 수 있는 작품입니다. 정말 재밌게 잘 봤습니다 b,10
할머니 셋이 오랫만에 본 영화...각 배우들의 연기력 노래에 넘 감동받았고  좋았어요~,10
감동적이었습니다.  본 후에도 계속 여운이 남네요.,10
"저는 한번도 감상평을 남긴적이 없는데...이번영화는 정말... 너무나도 좋았어요뭐 연출, 구성이 개인마다 다르게 느낄지는몰라도 저는 다 좋았고 매 노래마다 벅차오르는 감동이 너무나 컸어요",10
스토리가 진부하고 타임라인이 엉성하긴 하지만 영상으로 그냥 끝장내는 영화 3시간이 넘는 시간동안 불편했던건 내 엉덩이뿐 초반엔 CG 끝장나고 현장감 쩐다 그러고 보다가 나중엔 저 물이 CG가 아니라 정말 물이 아닐까 하는 생각이 듬,8
일부러 평점 주러 들어옵니다. 방금 봤는데 만화에선 그냥 넘겼던 부분도 음악과 함께하니 울림이 있네요. 아는 내용인데도 120분 후딱가는 즐거운 시간이었습니다. 슬램덩크에 추억이 있는 분들은 꼭 한번 보시길 추천합니다. 일본 특유의 서정적인 감성과 잔잔함이 있으니 너무 극적인 음악과 연출을 기대하고 보시진 말기를,10
시작부터 이럼 반칙이자나요꼭 봐야할 영화네요감사합니다 ,10
ㅠㅠㅠㅠ나만 재미없었나? ,2
평생 서로를 지키고 의지하며 살아온 멋진 노부부의 아름다운 인생의 마지막 피날레를 행복하게 그릴수는 없었던 것인가?힘없이 단 둘이서 죽음을 기다리는 노인들처럼 표현해야 했는가?가슴아픈 눈물즙이 아니라 멋지게 살아온 노부부에 대한 존경을 표하는 영상일 수는 없었던 것인가...,2
 원시부족 휴먼 다큐멘터리 ..진부.. 영상미는 훌륭합니다(어릴때는 와 하고 봤는데 커서 눈 많이 높아졌나?),8
소년은 달에 갔을까? 그에게 평화가 함께하기를...,7
난 영화(映畵)를 본 것이 아니었다. 난 9720장의 명화(名畵)를 보았다.,10
"버리고 싶었지만, 누구도 버린적은 없다. ",10
눈물을 안흘릴수가 없더라구요 내용도 너무 잘봤습니다,10
마지막 1분 모든 사람이 숨죽이고 보고 있는데 옆에 딩초 조잘대는데 뚝배기 깨고 싶었다 부모는 한술 더 뜸 영화 볼 때 좀 입 닫아 제발 내 옆사람이 눈치 개주는데도 조잘대,10
진짜 인생 영화 처음으로 소장하고 싶은 영화…,10
"오랜만에 2023년 첫 영화로 뮤지컬영화 영웅, 단순히 국뽕을 넘어서 안중근과 독립운동가들의 희생과 결단을 담담하게 잘 그려냈다. 뮤지컬영화라서 영웅의 넘버들을 배우들의 노래가 그 상황을 더 절실하게 다가오게 하였다. 특히 박진주배우의 연기가 돋보였다. 스토리도 탄탄했다. 안중근과 독립운동을 다시 되새기는 영화였다. ",10
슬퍼도 뭐 얼마나 슬프겠어 하며 봤는데 그냥 주인공들이 처해있는 상황이 안타까웠어요 감정이입해서 눈물이 나온것 같고 영화 급전개 장면이 아쉬웠네용 ,10
Two thumbs up!,10
감독님 로또 안해보셨나요? 누가 마킹지들고 번호 맞춤??? 발매된 표보고 맞추지,1
omg!!!! 우림이 여민이~~~~,10
"재밌음, 다만 스토리가 차기작 3,4,5를 준비하는 빌드업 느낌",10
오랜만에 봤는데 다시봐도 재밌네요 ㅋㅋ역시 명작은 시대를 가리지 않아,9
진짜 꼭 봐야될 영화 나라를 위해 희생하신 모든 분들께 감사합니다,10
재미있다! 시간 가는줄 모르겠다,10
지금 봐도 잘 만든 영화..,8
"진짜 미쳤습니다.그냥 다른말로 설명이 안돼요그냥 미쳤습니다.아이 참 이런걸 왜 봐?라고 생각하지마세요 그것은 완벽한 당신의 오산?완벽한 그림,보장되어 있는 퍼펙트한 스토리그리고 소름돋는 성우들의 목소리.. 꼭 보세요 명령입니다",10
"&amp;#39;소원은 멀리 있지 않습니다. 고개를 들어 눈 앞을 바라 보세요.&amp;#39; 라는 큰 메시지를 담고 있습니다. 이야기가 지루하지도 않고 무엇보다 연출이 세련된 톰과 제리를 보는 듯한 느낌이여서 참 좋네요. 아이, 어른 모두 재미있게 만족할만한 그런 애니메이션이라 생각이 됩니다.  ",10
졸린 그저그런 영환줄알고 봤다 큰코다쳤다아~  진짜 스토리 짜임세있게 잘만들었고배우들의 연기가 극에달했다고본다내평생 본 잘만들어진 영화 3위안에든다,10
"다들 어떻게 흘러갈지 알잖아요, 딱 원하는 그대로 만들어줌",5
이건 연령을 12세이상 19세 미만으로 설정해놔야할듯한데세상 슬프다해서 봤더니만 지루하기 그지없고필름은 쌍팔년도 드라마보다못하고연기는 .. 윽 .. 사람이없어서 미리나가는것도 민망해서 그냥저냥시간떼우다나왔는데 이런레기가따로없음 평점을보고가는거였어...,1
기대 이상이다.. 이건 무조건 극장에서 봐야함,10
오랜만에 좋은 영화 감상했네요~ ,9
"눈이 행복한 컴퓨터 그래픽과 마음이 풍족해지는 스토리,,이국적이고 아름다운 판도라 세계에 살고 싶어서 비는 중. 다음 생은 판도라 세상에 살게 해주세여",10
"하룻밤의 아라비안 나이트를 꿈꾼 듯, 사랑은 시키지 않아도 하는 것.",9
